{
  "api_version": "agent-platform/v1alpha1",
  "kind": "Checkpoint",
  "metadata": {
    "annotations": {},
    "created_at": "2026-08-28T00:00:00Z",
    "created_by": {
      "actor_id": "usr_0198f6d0-7ef0-7b0e-a0d3-5f9c96c7f402",
      "actor_type": "user",
      "tenant_id": "ten_0198f6d0-7ef0-7b0e-a0d3-5f9c96c7f401"
    },
    "id": "ckp_0198f6d0-7ef0-7b0e-a0d3-5f9c96c7f423",
    "labels": {
      "domain": "development"
    },
    "revision": 1,
    "scope": {
      "project_id": "prj_0198f6d0-7ef0-7b0e-a0d3-5f9c96c7f403",
      "tenant_id": "ten_0198f6d0-7ef0-7b0e-a0d3-5f9c96c7f401",
      "type": "project",
      "user_id": "usr_0198f6d0-7ef0-7b0e-a0d3-5f9c96c7f402"
    },
    "updated_at": "2026-08-28T01:00:00Z"
  },
  "spec": {
    "context_digest": "sha256:00000000000000000000000000000000000000000000000000000000000000d2",
    "created_reason": "node_end",
    "graph_state": {
      "completed": false,
      "step": "inspect_repository"
    },
    "node_state": {
      "current_node": "inspect",
      "next_node": "summarize"
    },
    "pending_approvals": [],
    "pending_tool_calls": [
      {
        "id": "tcl_0198f6d0-7ef0-7b0e-a0d3-5f9c96c7f424",
        "kind": "ToolCall"
      }
    ],
    "resume_token_ref": {
      "field": "resume_token",
      "key": "runtime/checkpoints/run-001",
      "provider": "vault",
      "version": 1
    },
    "run_ref": {
      "id": "run_0198f6d0-7ef0-7b0e-a0d3-5f9c96c7f422",
      "kind": "AgentRun"
    },
    "sequence": 1,
    "side_effect_ledger": []
  },
  "status": {
    "phase": "committed"
  }
}
